{
  "schemaVersion": "0.1",
  "source": {
    "kind": "synthetic"
  },
  "extraction": {
    "status": "complete",
    "fields": {},
    "warnings": [
      "Fictional renderer fixture."
    ]
  },
  "game": {
    "turn": 0,
    "width": 16,
    "height": 10,
    "wrapX": true,
    "wrapY": false,
    "coordinates": "odd-r-bottom-up"
  },
  "civilizations": [
    {
      "id": 0,
      "name": "Amber League",
      "key": "SYNTHETIC_AMBER",
      "kind": "major",
      "color": "#d99572"
    },
    {
      "id": 1,
      "name": "Verdant Union",
      "key": "SYNTHETIC_VERDANT",
      "kind": "major",
      "color": "#9ab77a"
    },
    {
      "id": 2,
      "name": "Isles",
      "key": "SYNTHETIC_ISLES",
      "kind": "city-state",
      "color": "#c5a6c7"
    }
  ],
  "tiles": [
    {
      "x": 0,
      "y": 0,
      "landWater": "water",
      "terrain": "TERRAIN_OCEAN",
      "elevation": "flat",
      "feature": null,
      "owner": null,
      "ownershipKnown": true,
      "riverEdges": [],
      "isLake": null,
      "visibility": null
    },
    {
      "x": 1,
      "y": 0,
      "landWater": "water",
      "terrain": "TERRAIN_OCEAN",
      "elevation": "flat",
      "feature": null,
      "owner": null,
      "ownershipKnown": true,
      "riverEdges": [],
      "isLake": null,
      "visibility": null
    },
    {
      "x": 2,
      "y": 0,
      "landWater": "water",
      "terrain": "TERRAIN_OCEAN",
      "elevation": "flat",
      "feature": null,
      "owner": null,
      "ownershipKnown": true,
      "riverEdges": [],
      "isLake": null,
      "visibility": null
    },
    {
      "x": 3,
      "y": 0,
      "landWater": "water",
      "terrain": "TERRAIN_OCEAN",
      "elevation": "flat",
      "feature": null,
      "owner": null,
      "ownershipKnown": true,
      "riverEdges": [],
      "isLake": null,
      "visibility": null
    },
    {
      "x": 4,
      "y": 0,
      "landWater": "water",
      "terrain": "TERRAIN_OCEAN",
      "elevation": "flat",
      "feature": null,
      "owner": null,
      "ownershipKnown": true,
      "riverEdges": [],
      "isLake": null,
      "visibility": null
    },
    {
      "x": 5,
      "y": 0,
      "landWater": "water",
      "terrain": "TERRAIN_OCEAN",
      "elevation": "flat",
      "feature": null,
      "owner": null,
      "ownershipKnown": true,
      "riverEdges": [],
      "isLake": null,
      "visibility": null
    },
    {
      "x": 6,
      "y": 0,
      "landWater": "water",
      "terrain": "TERRAIN_OCEAN",
      "elevation": "flat",
      "feature": null,
      "owner": null,
      "ownershipKnown": true,
      "riverEdges": [],
      "isLake": null,
      "visibility": null
    },
    {
      "x": 7,
      "y": 0,
      "landWater": "water",
      "terrain": "TERRAIN_OCEAN",
      "elevation": "flat",
      "feature": null,
      "owner": null,
      "ownershipKnown": true,
      "riverEdges": [],
      "isLake": null,
      "visibility": null
    },
    {
      "x": 8,
      "y": 0,
      "landWater": "water",
      "terrain": "TERRAIN_OCEAN",
      "elevation": "flat",
      "feature": null,
      "owner": null,
      "ownershipKnown": true,
      "riverEdges": [],
      "isLake": null,
      "visibility": null
    },
    {
      "x": 9,
      "y": 0,
      "landWater": "water",
      "terrain": "TERRAIN_OCEAN",
      "elevation": "flat",
      "feature": null,
      "owner": null,
      "ownershipKnown": true,
      "riverEdges": [],
      "isLake": null,
      "visibility": null
    },
    {
      "x": 10,
      "y": 0,
      "landWater": "water",
      "terrain": "TERRAIN_OCEAN",
      "elevation": "flat",
      "feature": null,
      "owner": null,
      "ownershipKnown": true,
      "riverEdges": [],
      "isLake": null,
      "visibility": null
    },
    {
      "x": 11,
      "y": 0,
      "landWater": "water",
      "terrain": "TERRAIN_OCEAN",
      "elevation": "flat",
      "feature": null,
      "owner": null,
      "ownershipKnown": true,
      "riverEdges": [],
      "isLake": null,
      "visibility": null
    },
    {
      "x": 12,
      "y": 0,
      "landWater": "water",
      "terrain": "TERRAIN_OCEAN",
      "elevation": "flat",
      "feature": null,
      "owner": null,
      "ownershipKnown": true,
      "riverEdges": [],
      "isLake": null,
      "visibility": null
    },
    {
      "x": 13,
      "y": 0,
      "landWater": "water",
      "terrain": "TERRAIN_OCEAN",
      "elevation": "flat",
      "feature": null,
      "owner": null,
      "ownershipKnown": true,
      "riverEdges": [],
      "isLake": null,
      "visibility": null
    },
    {
      "x": 14,
      "y": 0,
      "landWater": "water",
      "terrain": "TERRAIN_OCEAN",
      "elevation": "flat",
      "feature": null,
      "owner": null,
      "ownershipKnown": true,
      "riverEdges": [],
      "isLake": null,
      "visibility": null
    },
    {
      "x": 15,
      "y": 0,
      "landWater": "water",
      "terrain": "TERRAIN_OCEAN",
      "elevation": "flat",
      "feature": null,
      "owner": null,
      "ownershipKnown": true,
      "riverEdges": [],
      "isLake": null,
      "visibility": null
    },
    {
      "x": 0,
      "y": 1,
      "landWater": "water",
      "terrain": "TERRAIN_OCEAN",
      "elevation": "flat",
      "feature": null,
      "owner": null,
      "ownershipKnown": true,
      "riverEdges": [],
      "isLake": null,
      "visibility": null
    },
    {
      "x": 1,
      "y": 1,
      "landWater": "water",
      "terrain": "TERRAIN_OCEAN",
      "elevation": "flat",
      "feature": null,
      "owner": null,
      "ownershipKnown": true,
      "riverEdges": [],
      "isLake": null,
      "visibility": null
    },
    {
      "x": 2,
      "y": 1,
      "landWater": "water",
      "terrain": "TERRAIN_OCEAN",
      "elevation": "flat",
      "feature": null,
      "owner": null,
      "ownershipKnown": true,
      "riverEdges": [],
      "isLake": null,
      "visibility": null
    },
    {
      "x": 3,
      "y": 1,
      "landWater": "water",
      "terrain": "TERRAIN_OCEAN",
      "elevation": "flat",
      "feature": null,
      "owner": null,
      "ownershipKnown": true,
      "riverEdges": [],
      "isLake": null,
      "visibility": null
    },
    {
      "x": 4,
      "y": 1,
      "landWater": "water",
      "terrain": "TERRAIN_OCEAN",
      "elevation": "flat",
      "feature": null,
      "owner": null,
      "ownershipKnown": true,
      "riverEdges": [],
      "isLake": null,
      "visibility": null
    },
    {
      "x": 5,
      "y": 1,
      "landWater": "water",
      "terrain": "TERRAIN_OCEAN",
      "elevation": "flat",
      "feature": null,
      "owner": null,
      "ownershipKnown": true,
      "riverEdges": [],
      "isLake": null,
      "visibility": null
    },
    {
      "x": 6,
      "y": 1,
      "landWater": "water",
      "terrain": "TERRAIN_OCEAN",
      "elevation": "flat",
      "feature": null,
      "owner": null,
      "ownershipKnown": true,
      "riverEdges": [],
      "isLake": null,
      "visibility": null
    },
    {
      "x": 7,
      "y": 1,
      "landWater": "water",
      "terrain": "TERRAIN_OCEAN",
      "elevation": "flat",
      "feature": null,
      "owner": null,
      "ownershipKnown": true,
      "riverEdges": [],
      "isLake": null,
      "visibility": null
    },
    {
      "x": 8,
      "y": 1,
      "landWater": "water",
      "terrain": "TERRAIN_OCEAN",
      "elevation": "flat",
      "feature": null,
      "owner": null,
      "ownershipKnown": true,
      "riverEdges": [],
      "isLake": null,
      "visibility": null
    },
    {
      "x": 9,
      "y": 1,
      "landWater": "water",
      "terrain": "TERRAIN_OCEAN",
      "elevation": "flat",
      "feature": null,
      "owner": null,
      "ownershipKnown": true,
      "riverEdges": [],
      "isLake": null,
      "visibility": null
    },
    {
      "x": 10,
      "y": 1,
      "landWater": "water",
      "terrain": "TERRAIN_OCEAN",
      "elevation": "flat",
      "feature": null,
      "owner": null,
      "ownershipKnown": true,
      "riverEdges": [],
      "isLake": null,
      "visibility": null
    },
    {
      "x": 11,
      "y": 1,
      "landWater": "water",
      "terrain": "TERRAIN_OCEAN",
      "elevation": "flat",
      "feature": null,
      "owner": null,
      "ownershipKnown": true,
      "riverEdges": [],
      "isLake": null,
      "visibility": null
    },
    {
      "x": 12,
      "y": 1,
      "landWater": "water",
      "terrain": "TERRAIN_OCEAN",
      "elevation": "flat",
      "feature": null,
      "owner": null,
      "ownershipKnown": true,
      "riverEdges": [],
      "isLake": null,
      "visibility": null
    },
    {
      "x": 13,
      "y": 1,
      "landWater": "land",
      "terrain": "TERRAIN_GRASS",
      "elevation": "flat",
      "feature": null,
      "owner": 2,
      "ownershipKnown": true,
      "riverEdges": [],
      "isLake": null,
      "visibility": null
    },
    {
      "x": 14,
      "y": 1,
      "landWater": "water",
      "terrain": "TERRAIN_OCEAN",
      "elevation": "flat",
      "feature": null,
      "owner": null,
      "ownershipKnown": true,
      "riverEdges": [],
      "isLake": null,
      "visibility": null
    },
    {
      "x": 15,
      "y": 1,
      "landWater": "water",
      "terrain": "TERRAIN_OCEAN",
      "elevation": "flat",
      "feature": null,
      "owner": null,
      "ownershipKnown": true,
      "riverEdges": [],
      "isLake": null,
      "visibility": null
    },
    {
      "x": 0,
      "y": 2,
      "landWater": "water",
      "terrain": "TERRAIN_OCEAN",
      "elevation": "flat",
      "feature": null,
      "owner": null,
      "ownershipKnown": true,
      "riverEdges": [],
      "isLake": null,
      "visibility": null
    },
    {
      "x": 1,
      "y": 2,
      "landWater": "water",
      "terrain": "TERRAIN_OCEAN",
      "elevation": "flat",